{
  "schema_version": 1,
  "typescript": {
    "version": "5.1.6"
  },
  "tsconfig": {
    "path": "tsconfig.json",
    "sha256": "684e30fdcd53b99a9254f8e2ffdb90fd36663a030ba4b6fb9d91eca3b4bcb046"
  },
  "emit_options": {
    "allowSyntheticDefaultImports": true,
    "declaration": false,
    "emitDecoratorMetadata": true,
    "esModuleInterop": true,
    "experimentalDecorators": true,
    "forceConsistentCasingInFileNames": true,
    "incremental": false,
    "lib": [
      "lib.es2021.d.ts"
    ],
    "module": 1,
    "removeComments": false,
    "rootDir": "src",
    "skipLibCheck": true,
    "sourceMap": false,
    "strict": true,
    "strictPropertyInitialization": false,
    "target": 8,
    "types": [
      "node"
    ]
  },
  "sources": [
    {
      "path": "src/app.module.ts",
      "sha256": "9597efa4235a6df7a438af456eb4041337cb63fa1d947511b3380a875c193d84"
    },
    {
      "path": "src/app.setup.ts",
      "sha256": "b22d2f25899c8080e6f5dc46693fbc785ad9bbbf831b22baf6a377b5ea1123bb"
    },
    {
      "path": "src/categories/category.entity.ts",
      "sha256": "9e2682c7e1a818d4bbdaee266849a615ac076e855f124a6491e8889f4fc02254"
    },
    {
      "path": "src/extras/api-key.guard.ts",
      "sha256": "f224fc7f21fd73665a9a2624f8e1696b1fc88c93f5c86d086369e2131d53cdde"
    },
    {
      "path": "src/extras/client-id.decorator.ts",
      "sha256": "c1d3c69bdfb40347c040d40f12320b5ac5f053d37425d6cf46af042d774ac349"
    },
    {
      "path": "src/extras/domain-error.filter.ts",
      "sha256": "d44a6c6ad57139cb3298968648f76635dfa2c67f810ab27d9272773aed2da93c"
    },
    {
      "path": "src/extras/domain-error.ts",
      "sha256": "9395d80c9fd9f43b844a13fbd7cfa6335b0f0751d5a6281371d8baecd0b0b2fc"
    },
    {
      "path": "src/extras/dto/extra-payload.dto.ts",
      "sha256": "aa5bf0de575931592c884ff7d58cea82f7eba04795d02a31f59d1cdcc0cb659e"
    },
    {
      "path": "src/extras/envelope.interceptor.ts",
      "sha256": "56562b0307f9af489abca170c2bfde46c616ae5264cc13a8633bc41630f3e3e0"
    },
    {
      "path": "src/extras/extras.controller.ts",
      "sha256": "24098a745c977766b708aa0f4cbf4764929646c2abc3dabb15abdae79002cb45"
    },
    {
      "path": "src/extras/extras.module.ts",
      "sha256": "bee09a44dcf3f50bf7ed9baab39a803681517b2d0fd2680ffeb56f54e6dacf0a"
    },
    {
      "path": "src/health/health.controller.ts",
      "sha256": "1169b2e2c33e890f8c64066a20831f9ad9f03b35f7e5b54d89fc661ab216e772"
    },
    {
      "path": "src/health/health.module.ts",
      "sha256": "09b379f5dbecf2ac3f92ac60bb8e5c9cee86377125efcbb7dd1c4122e3bb766f"
    },
    {
      "path": "src/main.ts",
      "sha256": "4843b5c0dd108a3ec49e0ddd0f0dccaf0302b05d8e0ae87efb089302e7d1cabf"
    },
    {
      "path": "src/orders/order-item.entity.ts",
      "sha256": "56a6a41d66ccc1891eed886925816119af321ab6fb186d4e4f9f6aa5f1698bb3"
    },
    {
      "path": "src/products/dto/create-product.dto.ts",
      "sha256": "63a89effc2c71eac830978f0ee020f79d23bdb4570b321913f5aae9fb64c1183"
    },
    {
      "path": "src/products/dto/list-products.query.ts",
      "sha256": "92391b7e35b689fa8c75525daef4ced5c3a7a796d373c3d36951437aba4e2c08"
    },
    {
      "path": "src/products/product.entity.ts",
      "sha256": "08b37feb8b0fa4eb62c0e8b280d9bb6a08c330c7db907f959935cc04a765f79a"
    },
    {
      "path": "src/products/products.controller.ts",
      "sha256": "740a62360c3d7196651abbda07f0733af6e64f13e463a3f1974ffaa56b8e45a6"
    },
    {
      "path": "src/products/products.module.ts",
      "sha256": "168581696c14e6cf9dd87a49e629a40aee3d74ab346671ed0706b8549c7b59b4"
    },
    {
      "path": "src/products/products.service.ts",
      "sha256": "948f845cc41fd01fb944f17d6cb911adea987b5933c2d409f56c5d6c1b010bfc"
    },
    {
      "path": "src/reports/dto/sales-report.query.ts",
      "sha256": "cfcaff6c41c6d0d70fae9dc8530aceaa42296094b5185b67fd0a7429ac924e05"
    },
    {
      "path": "src/reports/reports.controller.ts",
      "sha256": "c6a57aa32a22546092c3e501927c7596f1df0fc161ff9baf84300ad67828c699"
    },
    {
      "path": "src/reports/reports.module.ts",
      "sha256": "c9ff8f4464561d979d89d108fa598f7d18a90e60a5852e0a4413e6aef2dcec66"
    },
    {
      "path": "src/reports/reports.service.ts",
      "sha256": "faddd27c706e3ae0e3de58e0464b613b23d115ff13d66436da2899df37cbf993"
    },
    {
      "path": "src/throttled/throttled.controller.ts",
      "sha256": "c18d4d6873872284e602b826a54e8aa55718a87c902336ee9f639e757967ed4d"
    },
    {
      "path": "src/throttled/throttled.module.ts",
      "sha256": "b3cf9e5bb085522ab9a974f5d203f5b23ab9d1ecb09b6efba63b020ee3c2c1bc"
    }
  ],
  "outputs": [
    {
      "path": "app.module.js",
      "sha256": "c9fe2d4eebbfa54cce9de87ca0ff3e5e443afc2792bbea83cd7297397488d062"
    },
    {
      "path": "app.setup.js",
      "sha256": "14dc647311a044829de6b997cb30d974ca3fc74b9396a0d8193c72bd36134dd4"
    },
    {
      "path": "categories/category.entity.js",
      "sha256": "fb2f7321c3de39512b7c8f40b9626a2eac653c7699f32d56fc805166536e53ef"
    },
    {
      "path": "extras/api-key.guard.js",
      "sha256": "7da83efc888892a7a7093083b487a456306d3fbb96947b10df3e19bc6e156a69"
    },
    {
      "path": "extras/client-id.decorator.js",
      "sha256": "21596bd1d2633ade2ffab807764a839559cb00db6a5b16863dbe832f95e7933b"
    },
    {
      "path": "extras/domain-error.filter.js",
      "sha256": "9e38ba4800ae5071fab68d41e73c14c3797ff9188d20d0d8e7b23e08f53fd1b8"
    },
    {
      "path": "extras/domain-error.js",
      "sha256": "6893370cde4cdb4e26dd6cbe92db9b3e724c9ab13a9cf9b47365c35eecb87560"
    },
    {
      "path": "extras/dto/extra-payload.dto.js",
      "sha256": "cc955d42167eab5543a0744dac31d8f902e05840cb23090d5b591a7c93669ed1"
    },
    {
      "path": "extras/envelope.interceptor.js",
      "sha256": "859f4dcd8d011a492480b0a6641a381cb1a9ae572143d97fbd757d2e10d93550"
    },
    {
      "path": "extras/extras.controller.js",
      "sha256": "147cf0fd34f1073e06e2d5dc19b09c5bf9e3d4353abee4fb08345ec211523437"
    },
    {
      "path": "extras/extras.module.js",
      "sha256": "68c05216a555b9cdd0929c66a19f17f65045f098ec8874d1381a6f825ab3a776"
    },
    {
      "path": "health/health.controller.js",
      "sha256": "aa2c40837c7a4994ec027df86402cc61f543fc5dbcb6f1c85fdad3dc814001ca"
    },
    {
      "path": "health/health.module.js",
      "sha256": "60f2c1fca59b5425556e14b10fb881c347a80ca85749e361e15cea08eaee2d66"
    },
    {
      "path": "main.js",
      "sha256": "715fea15e98f558dc682edfbce3e41ec9680647678ce6197acd56b0b3806e3f4"
    },
    {
      "path": "orders/order-item.entity.js",
      "sha256": "d25992a6a5a9d8beec184f1c66be37d13c057f84bef1cb0862dbc0b4a13243a2"
    },
    {
      "path": "products/dto/create-product.dto.js",
      "sha256": "a825d049308da64734125b15748a9f6419ab55f103c9d666e9d02908085ac22f"
    },
    {
      "path": "products/dto/list-products.query.js",
      "sha256": "fa88cc95bda3e45789df9113424f36a584936dac8102c61302a4b2c91465f2e8"
    },
    {
      "path": "products/product.entity.js",
      "sha256": "5f8c24498836a73e444c1cde6863e71028107179c45fa86a49edfc8e1c4e71f9"
    },
    {
      "path": "products/products.controller.js",
      "sha256": "b6139ecc601575fcba2ddb7a3e039ada60635f49340377ba83b334931779c06f"
    },
    {
      "path": "products/products.module.js",
      "sha256": "ef62fce1399ba78ca49568ec825ee7ab012ec6b57bcb622ab7828fd786b43bc5"
    },
    {
      "path": "products/products.service.js",
      "sha256": "30d65b29e8233203f742499253b31510002d5fb89ad5c812c5cd17e5b80009a8"
    },
    {
      "path": "reports/dto/sales-report.query.js",
      "sha256": "a0ba5fdc009bcf03c23bb050b490772eb3da8e955dfc124fd4cb96b00013fcdc"
    },
    {
      "path": "reports/reports.controller.js",
      "sha256": "92da0d888356e3724a39cb669b198050f2d856738e3a354eec99967f3b64551c"
    },
    {
      "path": "reports/reports.module.js",
      "sha256": "6bef7077176a71a9d509f3507b05872f39e02e784bd8a800733e8079fa06c202"
    },
    {
      "path": "reports/reports.service.js",
      "sha256": "6b5607c988fcc025008aba830b2710ee29e01ceaf5cc59aded3fb692866e85e2"
    },
    {
      "path": "throttled/throttled.controller.js",
      "sha256": "1b7de8a8d2dad91166a903fe651f931215d0d20435c1c0bc34f41c51c02b6b58"
    },
    {
      "path": "throttled/throttled.module.js",
      "sha256": "5b9a283b733e3838f5d7284adbb8853d715548824d680d311e1512b740a99c8a"
    }
  ]
}
